A1: Controle de Horas Extras (Modelo)
A2: MÊS: | D2: MARÇO/2014 | G2: Data | H2: Dia | I2: Tipo | J2: Entrada | K2: Almoço | M2: Saída | N2: Total Horas | O2: Hora Normal | P2: Hora Extras | Q2: Extras
A3: EMPREGADO: | D3: CARLOS BEZERRA DE OLIVEIRA | G3: 01/03/yy | H3: =IF(G3<>" ";G3;" ") -> Sun | I3: =IF(G3<>" ";LOOKUP(WEEKDAY(H3;2);$B$9:$B$11;$C$9:$C$11);" ") -> H3 | N3: =(M3-J3-(L3-K3))*24 -> 000 | O3: =IF(I3=$C$9;8;IF(I3=$C$10;4;IF(I3=$C$11;" ";" "))) ->  | P3: =IF(N3=0;" ";N3-O3) ->  | Q3: =IF(P3=" ";" ";P3*$D$7+(IF(I3=$C$9;P3*$D$7*$F$9;IF(I3=$C$10;P3*$D$7*$F$10;IF(I3=$C$11;P3*$D$7*$F$10))))) -> 
A4: MATRÍCULA: | D4: 125 | G4: =G3+1 -> 02/03/yy | H4: =IF(G4<>" ";G4;" ") -> Mon | I4: =IF(G4<>" ";LOOKUP(WEEKDAY(H4;2);$B$9:$B$11;$C$9:$C$11);" ") -> H1 | J4: 7:00 | K4: 11:00 | L4: 12:00 | M4: 17:00 | N4: =(M4-J4-(L4-K4))*24 -> 009 | O4: =IF(I4=$C$9;8;IF(I4=$C$10;4;IF(I4=$C$11;" ";" "))) -> 8 | P4: =IF(N4=0;" ";N4-O4) -> 01 | Q4: =IF(P4=" ";" ";P4*$D$7+(IF(I4=$C$9;P4*$D$7*$F$9;IF(I4=$C$10;P4*$D$7*$F$10;IF(I4=$C$11;P4*$D$7*$F$10))))) -> R$ 10,2000
A5: FUNÇÃO: | D5: Operador | G5: =G4+1 -> 03/03/yy | H5: =IF(G5<>" ";G5;" ") -> Tue | I5: =IF(G5<>" ";LOOKUP(WEEKDAY(H5;2);$B$9:$B$11;$C$9:$C$11);" ") -> H1 | J5: 7:00 | K5: 12:00 | L5: 13:00 | M5: 18:00 | N5: =(M5-J5-(L5-K5))*24 -> 010 | O5: =IF(I5=$C$9;8;IF(I5=$C$10;4;IF(I5=$C$11;" ";" "))) -> 8 | P5: =IF(N5=0;" ";N5-O5) -> 02 | Q5: =IF(P5=" ";" ";P5*$D$7+(IF(I5=$C$9;P5*$D$7*$F$9;IF(I5=$C$10;P5*$D$7*$F$10;IF(I5=$C$11;P5*$D$7*$F$10))))) -> R$ 20,4000
A6: SALÁRIO: | D6: =220*6 -> R$ 1.320,000 | G6: =G5+1 -> 04/03/yy | H6: =IF(G6<>" ";G6;" ") -> Wed | I6: =IF(G6<>" ";LOOKUP(WEEKDAY(H6;2);$B$9:$B$11;$C$9:$C$11);" ") -> H1 | J6: 6:00 | K6: 11:00 | L6: 12:00 | M6: 15:00 | N6: =(M6-J6-(L6-K6))*24 -> 008 | O6: =IF(I6=$C$9;8;IF(I6=$C$10;4;IF(I6=$C$11;" ";" "))) -> 8 | P6: =IF(N6=0;" ";N6-O6) -> 00 | Q6: =IF(P6=" ";" ";P6*$D$7+(IF(I6=$C$9;P6*$D$7*$F$9;IF(I6=$C$10;P6*$D$7*$F$10;IF(I6=$C$11;P6*$D$7*$F$10))))) -> R$ -
A7: HORA NORMAL: | D7: =D6/220 -> R$ 6,000 | G7: =G6+1 -> 05/03/yy | H7: =IF(G7<>" ";G7;" ") -> Thu | I7: =IF(G7<>" ";LOOKUP(WEEKDAY(H7;2);$B$9:$B$11;$C$9:$C$11);" ") -> H1 | N7: =(M7-J7-(L7-K7))*24 -> 000 | O7: =IF(I7=$C$9;8;IF(I7=$C$10;4;IF(I7=$C$11;" ";" "))) -> 8 | P7: =IF(N7=0;" ";N7-O7) ->  | Q7: =IF(P7=" ";" ";P7*$D$7+(IF(I7=$C$9;P7*$D$7*$F$9;IF(I7=$C$10;P7*$D$7*$F$10;IF(I7=$C$11;P7*$D$7*$F$10))))) -> 
A8: HORÁRIO SEMANAL: | D8: ENTRADA | E8: SAÍDA | F8: PERCENT. | G8: =G7+1 -> 06/03/yy | H8: =IF(G8<>" ";G8;" ") -> Fri | I8: =IF(G8<>" ";LOOKUP(WEEKDAY(H8;2);$B$9:$B$11;$C$9:$C$11);" ") -> H1 | N8: =(M8-J8-(L8-K8))*24 -> 000 | O8: =IF(I8=$C$9;8;IF(I8=$C$10;4;IF(I8=$C$11;" ";" "))) -> 8 | P8: =IF(N8=0;" ";N8-O8) ->  | Q8: =IF(P8=" ";" ";P8*$D$7+(IF(I8=$C$9;P8*$D$7*$F$9;IF(I8=$C$10;P8*$D$7*$F$10;IF(I8=$C$11;P8*$D$7*$F$10))))) -> 
A9: DIAS ÚTEIS | B9: 1 | C9: H1 | D9: 07:00 | E9: 16:00 | F9: 70% | G9: =G8+1 -> 07/03/yy | H9: =IF(G9<>" ";G9;" ") -> Sat | I9: =IF(G9<>" ";LOOKUP(WEEKDAY(H9;2);$B$9:$B$11;$C$9:$C$11);" ") -> H2 | N9: =(M9-J9-(L9-K9))*24 -> 000 | O9: =IF(I9=$C$9;8;IF(I9=$C$10;4;IF(I9=$C$11;" ";" "))) -> 4 | P9: =IF(N9=0;" ";N9-O9) ->  | Q9: =IF(P9=" ";" ";P9*$D$7+(IF(I9=$C$9;P9*$D$7*$F$9;IF(I9=$C$10;P9*$D$7*$F$10;IF(I9=$C$11;P9*$D$7*$F$10))))) -> 
A10: SÁBADOS | B10: 6 | C10: H2 | D10: 07:00 | E10: 11:00 | F10: 100% | G10: =G9+1 -> 08/03/yy | H10: =IF(G10<>" ";G10;" ") -> Sun | I10: =IF(G10<>" ";LOOKUP(WEEKDAY(H10;2);$B$9:$B$11;$C$9:$C$11);" ") -> H3 | N10: =(M10-J10-(L10-K10))*24 -> 000 | O10: =IF(I10=$C$9;8;IF(I10=$C$10;4;IF(I10=$C$11;" ";" "))) ->  | P10: =IF(N10=0;" ";N10-O10) ->  | Q10: =IF(P10=" ";" ";P10*$D$7+(IF(I10=$C$9;P10*$D$7*$F$9;IF(I10=$C$10;P10*$D$7*$F$10;IF(I10=$C$11;P10*$D$7*$F$10))))) -> 
A11: DOM/FERIADOS | B11: 7 | C11: H3 | F11: 100% | G11: =G10+1 -> 09/03/yy | H11: =IF(G11<>" ";G11;" ") -> Mon | I11: =IF(G11<>" ";LOOKUP(WEEKDAY(H11;2);$B$9:$B$11;$C$9:$C$11);" ") -> H1 | N11: =(M11-J11-(L11-K11))*24 -> 000 | O11: =IF(I11=$C$9;8;IF(I11=$C$10;4;IF(I11=$C$11;" ";" "))) -> 8 | P11: =IF(N11=0;" ";N11-O11) ->  | Q11: =IF(P11=" ";" ";P11*$D$7+(IF(I11=$C$9;P11*$D$7*$F$9;IF(I11=$C$10;P11*$D$7*$F$10;IF(I11=$C$11;P11*$D$7*$F$10))))) -> 
G12: =G11+1 -> 10/03/yy | H12: =IF(G12<>" ";G12;" ") -> Tue | I12: =IF(G12<>" ";LOOKUP(WEEKDAY(H12;2);$B$9:$B$11;$C$9:$C$11);" ") -> H1 | N12: =(M12-J12-(L12-K12))*24 -> 000 | O12: =IF(I12=$C$9;8;IF(I12=$C$10;4;IF(I12=$C$11;" ";" "))) -> 8 | P12: =IF(N12=0;" ";N12-O12) ->  | Q12: =IF(P12=" ";" ";P12*$D$7+(IF(I12=$C$9;P12*$D$7*$F$9;IF(I12=$C$10;P12*$D$7*$F$10;IF(I12=$C$11;P12*$D$7*$F$10))))) -> 
G13: =G12+1 -> 11/03/yy | H13: =IF(G13<>" ";G13;" ") -> Wed | I13: =IF(G13<>" ";LOOKUP(WEEKDAY(H13;2);$B$9:$B$11;$C$9:$C$11);" ") -> H1 | N13: =(M13-J13-(L13-K13))*24 -> 000 | O13: =IF(I13=$C$9;8;IF(I13=$C$10;4;IF(I13=$C$11;" ";" "))) -> 8 | P13: =IF(N13=0;" ";N13-O13) ->  | Q13: =IF(P13=" ";" ";P13*$D$7+(IF(I13=$C$9;P13*$D$7*$F$9;IF(I13=$C$10;P13*$D$7*$F$10;IF(I13=$C$11;P13*$D$7*$F$10))))) -> 
G14: =G13+1 -> 12/03/yy | H14: =IF(G14<>" ";G14;" ") -> Thu | I14: =IF(G14<>" ";LOOKUP(WEEKDAY(H14;2);$B$9:$B$11;$C$9:$C$11);" ") -> H1 | N14: =(M14-J14-(L14-K14))*24 -> 000 | O14: =IF(I14=$C$9;8;IF(I14=$C$10;4;IF(I14=$C$11;" ";" "))) -> 8 | P14: =IF(N14=0;" ";N14-O14) ->  | Q14: =IF(P14=" ";" ";P14*$D$7+(IF(I14=$C$9;P14*$D$7*$F$9;IF(I14=$C$10;P14*$D$7*$F$10;IF(I14=$C$11;P14*$D$7*$F$10))))) -> 
G15: =G14+1 -> 13/03/yy | H15: =IF(G15<>" ";G15;" ") -> Fri | I15: =IF(G15<>" ";LOOKUP(WEEKDAY(H15;2);$B$9:$B$11;$C$9:$C$11);" ") -> H1 | N15: =(M15-J15-(L15-K15))*24 -> 000 | O15: =IF(I15=$C$9;8;IF(I15=$C$10;4;IF(I15=$C$11;" ";" "))) -> 8 | P15: =IF(N15=0;" ";N15-O15) ->  | Q15: =IF(P15=" ";" ";P15*$D$7+(IF(I15=$C$9;P15*$D$7*$F$9;IF(I15=$C$10;P15*$D$7*$F$10;IF(I15=$C$11;P15*$D$7*$F$10))))) -> 
G16: =G15+1 -> 14/03/yy | H16: =IF(G16<>" ";G16;" ") -> Sat | I16: =IF(G16<>" ";LOOKUP(WEEKDAY(H16;2);$B$9:$B$11;$C$9:$C$11);" ") -> H2 | N16: =(M16-J16-(L16-K16))*24 -> 000 | O16: =IF(I16=$C$9;8;IF(I16=$C$10;4;IF(I16=$C$11;" ";" "))) -> 4 | P16: =IF(N16=0;" ";N16-O16) ->  | Q16: =IF(P16=" ";" ";P16*$D$7+(IF(I16=$C$9;P16*$D$7*$F$9;IF(I16=$C$10;P16*$D$7*$F$10;IF(I16=$C$11;P16*$D$7*$F$10))))) -> 
G17: =G16+1 -> 15/03/yy | H17: =IF(G17<>" ";G17;" ") -> Sun | I17: =IF(G17<>" ";LOOKUP(WEEKDAY(H17;2);$B$9:$B$11;$C$9:$C$11);" ") -> H3 | N17: =(M17-J17-(L17-K17))*24 -> 000 | O17: =IF(I17=$C$9;8;IF(I17=$C$10;4;IF(I17=$C$11;" ";" "))) ->  | P17: =IF(N17=0;" ";N17-O17) ->  | Q17: =IF(P17=" ";" ";P17*$D$7+(IF(I17=$C$9;P17*$D$7*$F$9;IF(I17=$C$10;P17*$D$7*$F$10;IF(I17=$C$11;P17*$D$7*$F$10))))) -> 
G18: =G17+1 -> 16/03/yy | H18: =IF(G18<>" ";G18;" ") -> Mon | I18: =IF(G18<>" ";LOOKUP(WEEKDAY(H18;2);$B$9:$B$11;$C$9:$C$11);" ") -> H1 | N18: =(M18-J18-(L18-K18))*24 -> 000 | O18: =IF(I18=$C$9;8;IF(I18=$C$10;4;IF(I18=$C$11;" ";" "))) -> 8 | P18: =IF(N18=0;" ";N18-O18) ->  | Q18: =IF(P18=" ";" ";P18*$D$7+(IF(I18=$C$9;P18*$D$7*$F$9;IF(I18=$C$10;P18*$D$7*$F$10;IF(I18=$C$11;P18*$D$7*$F$10))))) -> 
G19: =G18+1 -> 17/03/yy | H19: =IF(G19<>" ";G19;" ") -> Tue | I19: =IF(G19<>" ";LOOKUP(WEEKDAY(H19;2);$B$9:$B$11;$C$9:$C$11);" ") -> H1 | N19: =(M19-J19-(L19-K19))*24 -> 000 | O19: =IF(I19=$C$9;8;IF(I19=$C$10;4;IF(I19=$C$11;" ";" "))) -> 8 | P19: =IF(N19=0;" ";N19-O19) ->  | Q19: =IF(P19=" ";" ";P19*$D$7+(IF(I19=$C$9;P19*$D$7*$F$9;IF(I19=$C$10;P19*$D$7*$F$10;IF(I19=$C$11;P19*$D$7*$F$10))))) -> 
G20: =G19+1 -> 18/03/yy | H20: =IF(G20<>" ";G20;" ") -> Wed | I20: =IF(G20<>" ";LOOKUP(WEEKDAY(H20;2);$B$9:$B$11;$C$9:$C$11);" ") -> H1 | N20: =(M20-J20-(L20-K20))*24 -> 000 | O20: =IF(I20=$C$9;8;IF(I20=$C$10;4;IF(I20=$C$11;" ";" "))) -> 8 | P20: =IF(N20=0;" ";N20-O20) ->  | Q20: =IF(P20=" ";" ";P20*$D$7+(IF(I20=$C$9;P20*$D$7*$F$9;IF(I20=$C$10;P20*$D$7*$F$10;IF(I20=$C$11;P20*$D$7*$F$10))))) -> 
G21: =G20+1 -> 19/03/yy | H21: =IF(G21<>" ";G21;" ") -> Thu | I21: =IF(G21<>" ";LOOKUP(WEEKDAY(H21;2);$B$9:$B$11;$C$9:$C$11);" ") -> H1 | N21: =(M21-J21-(L21-K21))*24 -> 000 | O21: =IF(I21=$C$9;8;IF(I21=$C$10;4;IF(I21=$C$11;" ";" "))) -> 8 | P21: =IF(N21=0;" ";N21-O21) ->  | Q21: =IF(P21=" ";" ";P21*$D$7+(IF(I21=$C$9;P21*$D$7*$F$9;IF(I21=$C$10;P21*$D$7*$F$10;IF(I21=$C$11;P21*$D$7*$F$10))))) -> 
G22: =G21+1 -> 20/03/yy | H22: =IF(G22<>" ";G22;" ") -> Fri | I22: =IF(G22<>" ";LOOKUP(WEEKDAY(H22;2);$B$9:$B$11;$C$9:$C$11);" ") -> H1 | N22: =(M22-J22-(L22-K22))*24 -> 000 | O22: =IF(I22=$C$9;8;IF(I22=$C$10;4;IF(I22=$C$11;" ";" "))) -> 8 | P22: =IF(N22=0;" ";N22-O22) ->  | Q22: =IF(P22=" ";" ";P22*$D$7+(IF(I22=$C$9;P22*$D$7*$F$9;IF(I22=$C$10;P22*$D$7*$F$10;IF(I22=$C$11;P22*$D$7*$F$10))))) -> 
G23: =G22+1 -> 21/03/yy | H23: =IF(G23<>" ";G23;" ") -> Sat | I23: =IF(G23<>" ";LOOKUP(WEEKDAY(H23;2);$B$9:$B$11;$C$9:$C$11);" ") -> H2 | N23: =(M23-J23-(L23-K23))*24 -> 000 | O23: =IF(I23=$C$9;8;IF(I23=$C$10;4;IF(I23=$C$11;" ";" "))) -> 4 | P23: =IF(N23=0;" ";N23-O23) ->  | Q23: =IF(P23=" ";" ";P23*$D$7+(IF(I23=$C$9;P23*$D$7*$F$9;IF(I23=$C$10;P23*$D$7*$F$10;IF(I23=$C$11;P23*$D$7*$F$10))))) -> 
G24: =G23+1 -> 22/03/yy | H24: =IF(G24<>" ";G24;" ") -> Sun | I24: =IF(G24<>" ";LOOKUP(WEEKDAY(H24;2);$B$9:$B$11;$C$9:$C$11);" ") -> H3 | N24: =(M24-J24-(L24-K24))*24 -> 000 | O24: =IF(I24=$C$9;8;IF(I24=$C$10;4;IF(I24=$C$11;" ";" "))) ->  | P24: =IF(N24=0;" ";N24-O24) ->  | Q24: =IF(P24=" ";" ";P24*$D$7+(IF(I24=$C$9;P24*$D$7*$F$9;IF(I24=$C$10;P24*$D$7*$F$10;IF(I24=$C$11;P24*$D$7*$F$10))))) -> 
G25: =G24+1 -> 23/03/yy | H25: =IF(G25<>" ";G25;" ") -> Mon | I25: =IF(G25<>" ";LOOKUP(WEEKDAY(H25;2);$B$9:$B$11;$C$9:$C$11);" ") -> H1 | N25: =(M25-J25-(L25-K25))*24 -> 000 | O25: =IF(I25=$C$9;8;IF(I25=$C$10;4;IF(I25=$C$11;" ";" "))) -> 8 | P25: =IF(N25=0;" ";N25-O25) ->  | Q25: =IF(P25=" ";" ";P25*$D$7+(IF(I25=$C$9;P25*$D$7*$F$9;IF(I25=$C$10;P25*$D$7*$F$10;IF(I25=$C$11;P25*$D$7*$F$10))))) -> 
G26: =G25+1 -> 24/03/yy | H26: =IF(G26<>" ";G26;" ") -> Tue | I26: =IF(G26<>" ";LOOKUP(WEEKDAY(H26;2);$B$9:$B$11;$C$9:$C$11);" ") -> H1 | N26: =(M26-J26-(L26-K26))*24 -> 000 | O26: =IF(I26=$C$9;8;IF(I26=$C$10;4;IF(I26=$C$11;" ";" "))) -> 8 | P26: =IF(N26=0;" ";N26-O26) ->  | Q26: =IF(P26=" ";" ";P26*$D$7+(IF(I26=$C$9;P26*$D$7*$F$9;IF(I26=$C$10;P26*$D$7*$F$10;IF(I26=$C$11;P26*$D$7*$F$10))))) -> 
G27: =G26+1 -> 25/03/yy | H27: =IF(G27<>" ";G27;" ") -> Wed | I27: =IF(G27<>" ";LOOKUP(WEEKDAY(H27;2);$B$9:$B$11;$C$9:$C$11);" ") -> H1 | N27: =(M27-J27-(L27-K27))*24 -> 000 | O27: =IF(I27=$C$9;8;IF(I27=$C$10;4;IF(I27=$C$11;" ";" "))) -> 8 | P27: =IF(N27=0;" ";N27-O27) ->  | Q27: =IF(P27=" ";" ";P27*$D$7+(IF(I27=$C$9;P27*$D$7*$F$9;IF(I27=$C$10;P27*$D$7*$F$10;IF(I27=$C$11;P27*$D$7*$F$10))))) -> 
G28: =G27+1 -> 26/03/yy | H28: =IF(G28<>" ";G28;" ") -> Thu | I28: =IF(G28<>" ";LOOKUP(WEEKDAY(H28;2);$B$9:$B$11;$C$9:$C$11);" ") -> H1 | N28: =(M28-J28-(L28-K28))*24 -> 000 | O28: =IF(I28=$C$9;8;IF(I28=$C$10;4;IF(I28=$C$11;" ";" "))) -> 8 | P28: =IF(N28=0;" ";N28-O28) ->  | Q28: =IF(P28=" ";" ";P28*$D$7+(IF(I28=$C$9;P28*$D$7*$F$9;IF(I28=$C$10;P28*$D$7*$F$10;IF(I28=$C$11;P28*$D$7*$F$10))))) -> 
G29: =G28+1 -> 27/03/yy | H29: =IF(G29<>" ";G29;" ") -> Fri | I29: =IF(G29<>" ";LOOKUP(WEEKDAY(H29;2);$B$9:$B$11;$C$9:$C$11);" ") -> H1 | N29: =(M29-J29-(L29-K29))*24 -> 000 | O29: =IF(I29=$C$9;8;IF(I29=$C$10;4;IF(I29=$C$11;" ";" "))) -> 8 | P29: =IF(N29=0;" ";N29-O29) ->  | Q29: =IF(P29=" ";" ";P29*$D$7+(IF(I29=$C$9;P29*$D$7*$F$9;IF(I29=$C$10;P29*$D$7*$F$10;IF(I29=$C$11;P29*$D$7*$F$10))))) -> 
G30: =G29+1 -> 28/03/yy | H30: =IF(G30<>" ";G30;" ") -> Sat | I30: =IF(G30<>" ";LOOKUP(WEEKDAY(H30;2);$B$9:$B$11;$C$9:$C$11);" ") -> H2 | N30: =(M30-J30-(L30-K30))*24 -> 000 | O30: =IF(I30=$C$9;8;IF(I30=$C$10;4;IF(I30=$C$11;" ";" "))) -> 4 | P30: =IF(N30=0;" ";N30-O30) ->  | Q30: =IF(P30=" ";" ";P30*$D$7+(IF(I30=$C$9;P30*$D$7*$F$9;IF(I30=$C$10;P30*$D$7*$F$10;IF(I30=$C$11;P30*$D$7*$F$10))))) -> 
G31: =G30+1 -> 29/03/yy | H31: =IF(G31<>" ";G31;" ") -> Sun | I31: =IF(G31<>" ";LOOKUP(WEEKDAY(H31;2);$B$9:$B$11;$C$9:$C$11);" ") -> H3 | N31: =(M31-J31-(L31-K31))*24 -> 000 | O31: =IF(I31=$C$9;8;IF(I31=$C$10;4;IF(I31=$C$11;" ";" "))) ->  | P31: =IF(N31=0;" ";N31-O31) ->  | Q31: =IF(P31=" ";" ";P31*$D$7+(IF(I31=$C$9;P31*$D$7*$F$9;IF(I31=$C$10;P31*$D$7*$F$10;IF(I31=$C$11;P31*$D$7*$F$10))))) -> 
G32: =G31+1 -> 30/03/yy | H32: =IF(G32<>" ";G32;" ") -> Mon | I32: =IF(G32<>" ";LOOKUP(WEEKDAY(H32;2);$B$9:$B$11;$C$9:$C$11);" ") -> H1 | N32: =(M32-J32-(L32-K32))*24 -> 000 | O32: =IF(I32=$C$9;8;IF(I32=$C$10;4;IF(I32=$C$11;" ";" "))) -> 8 | P32: =IF(N32=0;" ";N32-O32) ->  | Q32: =IF(P32=" ";" ";P32*$D$7+(IF(I32=$C$9;P32*$D$7*$F$9;IF(I32=$C$10;P32*$D$7*$F$10;IF(I32=$C$11;P32*$D$7*$F$10))))) -> 
G33: =G32+1 -> 31/03/yy | H33: =IF(G33<>" ";G33;" ") -> Tue | I33: =IF(G33<>" ";LOOKUP(WEEKDAY(H33;2);$B$9:$B$11;$C$9:$C$11);" ") -> H1 | N33: =(M33-J33-(L33-K33))*24 -> 000 | O33: =IF(I33=$C$9;8;IF(I33=$C$10;4;IF(I33=$C$11;" ";" "))) -> 8 | P33: =IF(N33=0;" ";N33-O33) ->  | Q33: =IF(P33=" ";" ";P33*$D$7+(IF(I33=$C$9;P33*$D$7*$F$9;IF(I33=$C$10;P33*$D$7*$F$10;IF(I33=$C$11;P33*$D$7*$F$10))))) -> 
G34: TOTAIS | P34: =SUM(P3:P33) -> 03 | Q34: =SUM(Q3:Q33) -> R$ 30,6000